3C66w5Z0ixs,I ASKED HER TO BE MY GIRLFRIEND...
M9Pmf9AB4Mo,Apex Legends | Stories from the Outlands – “The Endorsement”
J78aPJ3VyNs,I left youtube for a month and THIS is what happened.
kXLn3HkpjaA,XXL 2020 Freshman Class Revealed - Official Announcement
VIUo6yapDbc,Ultimate DIY Home Movie Theater for The LaBrant Family!
w-aidBdvZo8,I Haven't Been Honest About My Injury.. Here's THE TRUTH
uet14uf9NsE,OUR FIRST FAMILY INTRO!!
ua4QMFQATco,CGP Grey was WRONG
SnsPZj91R7E,SURPRISING MY DAD WITH HIS DREAM TRUCK!! | Louie's Life
SsWHMAhshPQ,Ovi x Natanael Cano x Aleman x Big Soto - Vengo De Nada [Official Video]
49Z6Mv4_WCA,i don't know what im doing anymore
nt3VVyv5pxQ,Try Not To Laugh Challenge #51
I6hswz4rIrU,Rainbow Six Siege: Operation Shadow Legacy Reveal Trailer | Ubisoft [NA]
W7VK4DUHvKU,Lil Yachty & Future - Pardon Me (Official Video)
W9Aen8hG20Y,When Our Generation Gets Old and Hears a Throwback Song 5
BNeDH6UTmXw,Ten Minutes with Tyler Cameron | Q&A
6TIsR_7nrNc,Kylie Jenner Reacts To 'WAP' Music Video Backlash
gPdUslndvVI,Our Farm Got Destroyed.
GTp-0S82guE,Time to Talk..
jbGRowa5tIk,ITZY “Not Shy” M/V TEASER
vePc5V4h_kg,Shark Attack Test- Human Blood vs. Fish Blood
5WjcDji3xYc,Honest Trailers | Avatar: The Last Airbender
FopIxceEr8g,EXTREME Game of Hide and Seek in my NEW HOUSE!!
p7HGUZWq_8s,Doing Doja Cat’s Makeup!!
AMXT1ok5UBg,THIS IS THE END.
mLOe7vGI0YI,Beerus VS Sailor Galaxia (Dragon Ball VS Sailor Moon) | DEATH BATTLE!
Que4RnxYLNc,iann dior – Prospect ft. Lil Baby (Official Video)
z5l8ovbw_6M,Don't be a Tourist
2avPJ9TZNmU,Juice WRLD & The Weeknd - Smile (Official Video)
PT6hPvOqTYc,Being replaced.
9nidKH8cM38,TAXI CAB SLAYER KILLS 'TO KNOW HOW IT FEELS'
CezxKs9YLv0,"Here's Why We Do Sponsored Videos, What Are Your Thoughts?"
GYeKX_LPY9U,15 Friendliest Sea Creatures Around The World
9AecsACtkB4,Watch Secret Service agents pull Trump from a press briefing after shooting outside the White House
aG8QsfDisdg,"Hundreds of looters target stores downtown, across Chicago overnight; 100 arrested"
GGEBtW2mWOk,Addressing RUMORS About Me While Testing New Makeup
kgkALngcgnE,NLE Choppa - Top Shotta Flow (Official Music Video)
5V2B28OqfqM,"I Spent $1,000,000 On Lottery Tickets and WON"
Mle7n1PuH9o,Megan Thee Stallion | Revlon Makeup Tutorial
IuMAHR0OtH4,My dog goes swimming for the first time!
n_8hxS_7Vis,Shannon reacts to Kyle Kuzma's game-winning shot — I'm concerned about the Lakers | NBA | UNDISPUTED
OQZ5ht79nEw,Answering Your Assumptions About Us... Merrell Twins
zHPVGSwLhcg,Unboxing Apple's $129 Luxury Cable
gi3VMMiFHVg,Giannis Gets Ejected After Headbutting Mo Wagner
p6RatnMhDj8,I TOOK A PREGNANCY TEST...
zrsBjYukE8s,박진영 (J.Y. Park) When We Disco (Duet with 선미) M/V
N5KpIE2tz8M,Tom MacDonald - GRAVESTONES ALBUM
Aur7UgTGlL0,"TRAIL BLAZERS at MAVERICKS | FULL GAME HIGHLIGHTS | August 11, 2020"
XsmkTqsygD4,42 Dugg - Big 4's (Official Video)
KX06ksuS6Xo,Diljit Dosanjh: CLASH (Official) Music Video | G.O.A.T.
yVdH3QacEXc,Selena Gomez - This is the Year (Official Premiere Event)
hsm4poTWjMs,Cardi B - WAP feat. Megan Thee Stallion [Official Music Video]
9wDhKJsF5Zk,Cardi B Defends Kylie Jenner In 'WAP' Music Video As Fans Make Petition For Her Removal | PeopleTV
Tujt4APHPzo,FIRST DAY IN THE NEW HOUSE! Ellie and Jared Move In!
rs2Rcu0s_2k,SUMMER JOB! *Me And My Best Friend Got An Ice Cream Truck*
RQqJeIyyQBs,"Kali Uchis, Rico Nasty – Aquí Yo Mando [Official Music Video]"
1mZ1f_8YOEc,Widespread looting reported overnight in downtown Chicago
lIgtAxmA800,Lil Mosey - Top Gone (ft. Lunay) [Official Music Video]
JJk1ji23Ey8,Bonsai Fish Tank
8fUGbilT5MQ,ULTIMATE Summer Lemonade Cake! | How To Cake It with Yolanda Gampp
JNJN5HMkRao,Saved by the Bell | Official Teaser 2 | Peacock
xNFEor9dhY0,SURPRISING BEST FRIEND WITH BUBBA GUMP SHRIMP
6IN4ZcZAUbA,The global coffee crisis is coming
ar6UiTbuoSU,"THE OFFICIAL REVEAL OF MY NEW $10,000,000 HOUSE! (Full Tour)"
28YwvwneKoY,My Decaying Mind in Quarantine
YHX4lUSGUBI,'Don't mess with Dame Dolla' - Stephen A. reacts to Lillard's beef with Paul George | First Take
KmVG1Yx1kwQ,3 DAYS with the Samsung Galaxy Note 20 Ultra! | The Tech Chap
FQnJRVn3QVk,Watching Movie Trailers... Then Guessing Their Review Scores
PHYtv0v2DeA,"NUGGETS at LAKERS | FULL GAME HIGHLIGHTS | August 10, 2020"
jp47GeO6k6Q,How Does He Get Away With This?
8QsH_xPQFqM,ALREADY | Black Is King | Aliya Janell | Kany Diabate Choreography | Queens N Lettos
xTpr7piQu2M,FUT 21 | Official Trailer
bGtR3l_JeUo,Uncle Roger Meet Egg Fried Rice Lady (@Hersha Patel)
1hx4vCChBlI,robot boyfriend
lcnWx5tiwhM,Exposing My Browsing History!
RN8uoBwRr1k,Binging with Babish: Paunch Burger from Parks & Rec
goOmZUwQYlA,100k
KnE6u4hFx14,PAINTING OUR FACES ON BRENT'S NEW HOUSE! (REVENGE)
iR7UweUPeNw,"Can LeBron, AD and Kyle Kuzma Become LA's New ‘Big Three’? | NBA on TNT Tuesday"
5JC2trEXxhE,Seattle Police Chief Carmen Best will resign Tuesday
AG9qDVXEemc,CASH NASTY MADE A MISTAKE CHALLENGING ME TO THIS 1V1... @Agent 02
3qxGj18nAR4,MY FIRST DAY OF SCHOOL VLOG  *Senior Year* 2020-21
BpXkl4VdFhA,Swapping Outfits With A Drag Queen!
Gj_SlGSZFgA,Who Makes The BEST Hot Dog *Glizzy* 🌭
vzXYz61U3Gk,We Need Some Time Apart
koHs2-xKdEk,2HYPE Goes Shark Fishing!
hEU_MnFTJ_c,LIVE BIRTH OF OUR BABY BOY *EMOTIONAL*
tbsu-AWH-C0,Stephen Sharer - SLUSHIE (Official Music Video)
MKHriv5r8pk,Meet Kohl (Date #3) | Brooklyn's 10 DATES in 10 DAYS
vml4hskxqtE,Every Drive Thru Ever
YFn3NtG4bJ8,Collin Morikawa | Best Shots from His Final Round 64 at the 2020 PGA Championship
vysBEblWBoQ,Lewis sets UFC record! Derrick Lewis v Alexei Oleinik | UFC Highlights
F82kzN-ae3o,Grilled Ribeye Steak Sausage
QjB3I4zaKRk,Mozart La Para - El Papá del Lápiz (Video Oficial)
JXzk8G9aXI8,Avatar Intro but with Animals
GsL8veaFW-s,North Carolina 5.1 magnitude earthquake felt in several surrounding states
khhxZRo527Q,Our Fertility Journey: Episode 10
oXTcmpnjdBk,Collin Morikawa Hits Incredible Drive to Win 2020 PGA Championship
DrlnrRQK84A,I SURPRISED HIM WITH HIS DREAM CAR!!
6rhLJ6T6NDI,WE SECRETLY FILMED THE DOLAN TWINS | Jeff's Barbershop
Yvlmj0rtnpc,WE DID IT
ysdw7cmigZM,"Game Theory: Minecraft, Stop Using Diamonds!"
Q_KW4u0t07k,QUESADILLAS | Mexican Survival Guide
xX9PYIIgoEA,Rich Brian & eaJ of DAY6 - LOVE IN MY POCKET ❤️
3LqQB4HV8qg,I rescued my cat from the sewer
nk44yPCN3gM,$3000 vs. $500 Suspension Upgrade
UcXVnupm0zk,DID YOU FEEL IT? 5.1 magnitude earthquake in North Carolina
LNDhIGR-83w,Beirut explosion: Video shows new angle of the massive blast
0a5YhsnITFE,"LFR13 - QR, Game 5 - Done - CBJ 3, Tor 0"
avgBgc210bg,New videos of Beirut massive explosion emerging online
qn515i8xr-4,Surprising Thomas with a Motorcycle!!
fHKNO3DV78M,"Trump halts payroll tax, extends jobless benefits"
nX0NDmm1K1g,I hate the I am not a robot verification.
Oe9naV81gdY,12 Types of People on TikTok
53sqVjcdM4Q,Rating My Wife's Pregnancy Outfits
kzST_Q2Xbks,Draymond Green Shares Why He's Picking LeBron as the MVP | NBA on TNT
YwJyis4yOEA,ANSWERING YOUR ASSUMPTIONS ABOUT US 😭
#NAME?,Lapiz Conciente - 9 Dias
4OCcbUZuTUQ,TREASURE – ‘BOY’ 0809 SBS Inkigayo
arijxoU5nB0,"TIPPING DELIVERY DRIVERS $1,000 DOLLARS!!"
6Taz7ZzPYeI,DaBaby - Blind feat Young Thug (Official Audio)
CiCT7NCP6BY,Rod Wave - Letter From Houston (Official Music Video)
z9i14AlzWL0,VIDEOS that are truly funny
lw68FF0GEX8,JEOPARDY: SIDEMEN EDITION
gSc0o6xVnmY,Juice WRLD & The Weeknd - Smile (Official Lyric Video)
YIlhmtpDjmo,WHAT KSI SHOULD HAVE BOUGHT TOBI FOR SIDEMEN SUNDAY
8r1D-vNUWsg,☁️ 🍞 CLOUD BREAD
6f-jjV5LJoE,Road Rage – Why Motorcycle Riders Smash Windows
QsUfsZzxi9c,"Whatever You Build, I'll Pay For!"
THQH9QJKrIE,"Trump signs executive orders on unemployment, evictions, student loans and payroll tax"
xCkpA4_H1x4,UPDATE: CLAN WARS 2 ⚔️ How does it work? TV Royale - Clash Royale News
LI1hCQ-6P0Y,AN UMBRELLA ACADEMY UNBOXING
EukpxRuDUzA,Prepping My Apartment for My Boyfriend to Move In!
TUlFDVUTsKg,Highlights | Man City 2-1 Real Madrid | Champions League 2020 - Octavos de final | TUDN
Idp1xvmLPHo,LaBrant Family Baby Boy Name Reveal.
A5RHu1lTv14,Satina Wants a Bedtime Story (SATINA SHORT #1)
tqvEEqWGCyE,The (Real) Delusion That You're a Corpse
qq7MSjXHRTU,Barcelona vs. Napoli | Champions League Round of 16 Highlights | UCL on CBS Sports
bpmGuPhGE0Y,Machine Gun Kelly ft. blackbear - my ex's best friend (Official Lyric Video)
XlOLx3fyf10,TESTING TIKTOK ART TUTORIALS
HkTTPu_p2ps,Sleepy Hallow - “Water” feat. Sheff G (Official Music Video - WSHH Exclusive)
4UiaCC01Vwk,"DISNEY MEDLEY: Frozen II, The Little Mermaid, Moana, Aladdin + MORE"
#NAME?,LOGAN PAUL ADDRESSES JAKE PAUL'S FBI RAID
PORP0q8nThs,Getting Suspended In High School
IxFMyYuPPyw,Fixing Things I've Ruined #2
Of_C9g9O9KY,BABY BOY IS HERE! *OFFICIAL LABOR AND DELIVERY*
C8FzVistDHY,Professor who's been right about every election since 1984 reveals his 2020 prediction
FU92piysGBg,STILTED TRAMPOLINE STAIRCASE INTO THE OCEAN  | JOOGSQUAD PPJT
RsmttAEp9f4,Bayern Munich vs. Chelsea | Champions League Round of 16 Highlights | UCL on CBS Sports
6i01tOMgBDU,Ashnikko - Daisy (Official Video)
qzdGo7FBndA,Apex Legends Season 6 – Boosted Launch Trailer
rmn4F-K2RRI,Boatbuilding - Lining-out for Planking (EP78)
JxAlZOn4QhM,Rod Wave - Rags 2 Riches Ft. Lil Baby & ATR SonSon (Official Audio)
8tze9Z33K5A,The Proposal Part 2 She Said Yes!
hT3pPAdnlfA,"LAKERS at PACERS | FULL GAME HIGHLIGHTS | August 8, 2020"
Wc9_dsv5YYA,Doja Cat - Freak (Audio)
aAgJernobg8,GAME OVER - Mozart La Para (Video Oficial)
dktW5r4ldyo,Kane Brown - Cool Again (Official Video) ft. Nelly
Djy3WNLz_mM,The coronavirus is mutating. Now what?
JSAfPh1A25E,TREASURE - 'BOY' M/V
kz7gHA2N6nQ,"World's Strongest Man vs $10,000 Safe! *unbreakable*"
f7rq3DeFZew,Lil Keed - Obama Coupe [Official Video]
mBiWhzeZ_bU,First Shreds! Testing Our Duramax Swapped Camaro at Irwindale Speedway // Knuckle Busters 2 Ep.15
CfHieQ0SwpA,National SAT Practice Test Day
Svvesc9dW2E,TWICE Reacts To Guess That TWICE Song In Reverse Challenge (K-Pop)
5N8YRren5Z4,Popcaan  - TWIST & TURN (feat. Drake & PARTYNEXTDOOR) (Official Audio)
qQ8domUSU7M,Fall Guys in a Nutshell
D-ocerKPufk,The Kid LAROI - SELFISH (Official Video)
Dz3kroYIUkU,Jake Paul's Calabasas home raided by FBI
vrYcnMWWOeI,Odd1sOut VS Alex Clark: Planning Chess Boxing  ( Part 2 )
N2YxXgco_68,MORE toys that evaporate the ADHD from my body
v97FPN2US2o,Joji & Diplo - Daylight (Official Music Video)
cAtazIk1IYw,How To Make a Curried Egg Sandwich
NYFHnIiA8gE,Cake Rescue Fixing Viral Cake Fails | How To Cook That Ann Reardon new 2020
czwejgoH3zs,"Son, lemme teach you something new"
dO6YihaqtaQ,Trump takes executive action to address economy amid pandemic
sSjtGqRXQ9Y,JUDAS AND THE BLACK MESSIAH - Official Trailer
kcynVTnaHw0,Juventus vs. Lyon | CHAMPIONS LEAGUE Round of 16 Highlights | UCL on CBS Sports
HM_fkwDB-Xg,Yashahime: Princess Half-Demon | Official Announcement | VIZ
9wjvPD4-RyE,Russ - Why (Official Video)
FnSr820S2Mk,Explained: What happened in deadly Beirut explosion
Uxf0f27n-m4,Forgive Me - Live - Chloe x Halle
Jpl5mWJG2Uo,Haschak Sisters - GLOW (Music Video)
3bC2T0oFwoo,This is Goodbye
JLsDWPsx23c,NBA 2K21: Everything is Game (Current Gen Gameplay)
OpQlY2so3Mk,Let Me In
bdKm5hR2mBg,"FMB DZ, Sada Baby, Rio Da Yung OG - The Whoop Way (Official Video) Shot by @JerryPHD"
oxpQslt8x5s,"Ford Sticks It To Jeep By Taking The New Bronco On The Rubicon Trail: No, You're Wrong!"
ol4BJbIZHW4,(animated spellbook) 5E D&D Technology wizard
i9zLv77COc8,Our Big Announcement - Introducing TheShawFam
3-144RjSRWI,Pokémon: Twilight Wings | Episode 7 | Sky
eQhWGnKw5Hc,Boosie Badazz & MO3 - Mop Wit It (Official Video)
7QJPCIBgV5g,Cinemassacre Channel Update 2020
Ea04DriyYb4,Video shows Beirut blast as bride poses on her wedding day
Qn8dMQJlDZE,If 2020 Gave Us Zombies Instead Of A Pandemic
8Y_NXBHm92w,Beirut blast: two women on the ground in Lebanon describe the explosion and aftermath | 7NEWS
rr85rpSi0yI,If Real People Commercials were Real Life - CHEVY Fuel Efficiency/Grizzly Bear
K_uCyxNsHpo,Brooklyn's 10 DATES in 10 DAYS | Meet Jorge (Date #1)
hpMeCem6Hss,"I FOUGHT BRYCE HALL...Ft. Mike Majlak, Lana Rhoades, Steve will do it, Nelk Boys, Blake Gray"
gpY9qUbPXbM,Inside Beirut After the Explosion | WSJ
uf-36RC6JHE,Lapiz  Conciente - El Descanso Eterno
A3VYsISvUy4,Atalanta vs. PSG | Champions League Quarterfinal Highlights | UCL on CBS Sports
3C66w5Z0ixs,I ASKED HER TO BE MY GIRLFRIEND...
uhZE84C5g0M,Meet Matt (Date #4) | Brooklyn's 10 Dates in 10 Days
EDO8Z3O7lus,Biggest Trash Talker EVER Gets EXPOSED BAD! 1v1 Basketball In Arizona!
JCkyKujZplk,Rubi Rose He In His Feelings (Official Music Video)
wq5vHxY8kdU,A UNIQUE Start to Training Camp 2020! | Hard Knocks Los Angeles FULL Episode 1
J78aPJ3VyNs,I left youtube for a month and THIS is what happened.
ymyY7jez0rM,Joe Biden Introduces Sen. Kamala Harris (D-CA) As Running Mate
M9Pmf9AB4Mo,Apex Legends | Stories from the Outlands – “The Endorsement”
ay-8L8PZ6BI,Toosii - Reminiscing
NvgYhf2LnVI,[Dream SMP War] | Animatic
p35UfHw7PPI,Merkules - ''DEMONS'' (Official Video)
VIUo6yapDbc,Ultimate DIY Home Movie Theater for The LaBrant Family!
kXLn3HkpjaA,XXL 2020 Freshman Class Revealed - Official Announcement
SWlnzF8bFXM,We Buy a Donk Project. Goal: 1000HP! Part 1 of 69
SsWHMAhshPQ,Ovi x Natanael Cano x Aleman x Big Soto - Vengo De Nada [Official Video]
w-aidBdvZo8,I Haven't Been Honest About My Injury.. Here's THE TRUTH
2avPJ9TZNmU,Juice WRLD & The Weeknd - Smile (Official Video)
0La8uz7WJiU,Stephen A. reacts to Damian Lillard dropping 61 points vs. the Mavericks | First Take
ELS5RLbSukU,I Downloaded The World's Hardest Mod!
f8T_-E1ViVw,Gunna - WUNNA FLO (feat. Yak Gotti) [Official Video]
uet14uf9NsE,OUR FIRST FAMILY INTRO!!
NSuaUok-wTY,[1147] Locksmith Says My Videos Are BS... Loses $75 (Maybe)
CqRKOY4Cgvw,The new Surface Duo. Do one better.
49Z6Mv4_WCA,i don't know what im doing anymore
W7VK4DUHvKU,"Lil Yachty - Pardon Me ft. Future, Mike WiLL Made-It"
ua4QMFQATco,CGP Grey was WRONG
LrIFp4sAIGo,UNCUT Team TaylorMade Long Drive CONTEST With SIM | TaylorMade Golf
SnsPZj91R7E,SURPRISING MY DAD WITH HIS DREAM TRUCK!! | Louie's Life
#NAME?,The Weeknd Experience LIVE - Director's Cut (Trailer)
nt3VVyv5pxQ,Try Not To Laugh Challenge #51
gPdUslndvVI,Our Farm Got Destroyed.
I6hswz4rIrU,Rainbow Six Siege: Operation Shadow Legacy Reveal Trailer | Ubisoft [NA]
7g0oEVP1huA,Do Our Parents Approve Of Our Engagement? Q&A With Both Families
6TIsR_7nrNc,Kylie Jenner Reacts To 'WAP' Music Video Backlash
BNeDH6UTmXw,Ten Minutes with Tyler Cameron | Q&A
W9Aen8hG20Y,When Our Generation Gets Old and Hears a Throwback Song 5
Que4RnxYLNc,iann dior – Prospect ft. Lil Baby (Official Video)
GTp-0S82guE,Time to Talk..
jbGRowa5tIk,ITZY “Not Shy” M/V TEASER
AVYBAxqykdE,Mint Mobile Plus
7osSbbc2xVg,First Day of School GRWM + Vlog | College Edition | LexiVee03
p7HGUZWq_8s,Doing Doja Cat’s Makeup!!
vePc5V4h_kg,Shark Attack Test- Human Blood vs. Fish Blood
5WjcDji3xYc,Honest Trailers | Avatar: The Last Airbender
AMXT1ok5UBg,THIS IS THE END.
9nidKH8cM38,TAXI CAB SLAYER KILLS 'TO KNOW HOW IT FEELS'
mLOe7vGI0YI,Beerus VS Sailor Galaxia (Dragon Ball VS Sailor Moon) | DEATH BATTLE!
NYXABBpPJss,When you get on the grill for your friends Birthday
DiQ2AieIo0Q,Strongest Women VS Strongest Fish
z5l8ovbw_6M,Don't be a Tourist
GYeKX_LPY9U,15 Friendliest Sea Creatures Around The World
CezxKs9YLv0,"Here's Why We Do Sponsored Videos, What Are Your Thoughts?"
PT6hPvOqTYc,Being replaced.
FDq9QC206eU,Koffee - Pressure (Lyric Video)
KX06ksuS6Xo,Diljit Dosanjh: CLASH (Official) Music Video | G.O.A.T.
aG8QsfDisdg,"Hundreds of looters target stores downtown, across Chicago overnight; 100 arrested"
9AecsACtkB4,Watch Secret Service agents pull Trump from a press briefing after shooting outside the White House
kgkALngcgnE,NLE Choppa - Top Shotta Flow (Official Music Video)
GGEBtW2mWOk,Addressing RUMORS About Me While Testing New Makeup
zrsBjYukE8s,박진영 (J.Y. Park) When We Disco (Duet with 선미) M/V
FopIxceEr8g,EXTREME Game of Hide and Seek in my NEW HOUSE!!
Mle7n1PuH9o,Megan Thee Stallion | Revlon Makeup Tutorial
XsmkTqsygD4,42 Dugg - Big 4's (Official Video)
5V2B28OqfqM,"I Spent $1,000,000 On Lottery Tickets and WON"
Aur7UgTGlL0,"TRAIL BLAZERS at MAVERICKS | FULL GAME HIGHLIGHTS | August 11, 2020"
HRPaFOs4vu4,UFC 252 Embedded: Vlog Series - Episode 3
IuMAHR0OtH4,My dog goes swimming for the first time!
p6RatnMhDj8,I TOOK A PREGNANCY TEST...
N5KpIE2tz8M,Tom MacDonald - GRAVESTONES ALBUM
zHPVGSwLhcg,Unboxing Apple's $129 Luxury Cable
CyKAgXbEX3A,DLC「マニアクスパック」紹介PV ‐『真・女神転生III NOCTURNE HD REMASTER』
OQZ5ht79nEw,Answering Your Assumptions About Us... Merrell Twins
6IN4ZcZAUbA,The global coffee crisis is coming
lIgtAxmA800,Lil Mosey - Top Gone (ft. Lunay) [Official Music Video]
Tujt4APHPzo,FIRST DAY IN THE NEW HOUSE! Ellie and Jared Move In!
yVdH3QacEXc,Selena Gomez - This is the Year (Official Premiere Event)
8fUGbilT5MQ,ULTIMATE Summer Lemonade Cake! | How To Cake It with Yolanda Gampp
RQqJeIyyQBs,"Kali Uchis, Rico Nasty – Aquí Yo Mando [Official Music Video]"
hsm4poTWjMs,Cardi B - WAP feat. Megan Thee Stallion [Official Music Video]
fITRL6oXWao,Dame Drops 61 as the Blazers Playoff Quest Continues | NBA on TNT on Tuesday
JJk1ji23Ey8,Veggie & Fish Tank
rs2Rcu0s_2k,SUMMER JOB! *Me And My Best Friend Got An Ice Cream Truck*
gi3VMMiFHVg,Giannis Gets Ejected After Headbutting Mo Wagner
9wDhKJsF5Zk,Cardi B Defends Kylie Jenner In 'WAP' Music Video As Fans Make Petition For Her Removal | PeopleTV
vml4hskxqtE,Every Drive Thru Ever
YHX4lUSGUBI,'Don't mess with Dame Dolla' - Stephen A. reacts to Lillard's beef with Paul George | First Take
xNFEor9dhY0,SURPRISING BEST FRIEND WITH BUBBA GUMP SHRIMP
JNJN5HMkRao,Saved by the Bell | Official Teaser 2 | Peacock
n_8hxS_7Vis,Shannon reacts to Kyle Kuzma's game-winning shot — I'm concerned about the Lakers | NBA | UNDISPUTED
KmVG1Yx1kwQ,3 DAYS with the Samsung Galaxy Note 20 Ultra! | The Tech Chap
ar6UiTbuoSU,"THE OFFICIAL REVEAL OF MY NEW $10,000,000 HOUSE! (Full Tour)"
28YwvwneKoY,My Decaying Mind in Quarantine
1hx4vCChBlI,robot boyfriend
vzXYz61U3Gk,We Need Some Time Apart
FQnJRVn3QVk,Watching Movie Trailers... Then Guessing Their Review Scores
8QsH_xPQFqM,ALREADY | Black Is King | Aliya Janell | Kany Diabate Choreography | Queens N Lettos
1mZ1f_8YOEc,Widespread looting reported overnight in downtown Chicago
PHYtv0v2DeA,"NUGGETS at LAKERS | FULL GAME HIGHLIGHTS | August 10, 2020"
jp47GeO6k6Q,How Does He Get Away With This?
goOmZUwQYlA,100k
bGtR3l_JeUo,Uncle Roger Meet Egg Fried Rice Lady (@Hersha Patel)
AG9qDVXEemc,CASH NASTY MADE A MISTAKE CHALLENGING ME TO THIS 1V1... @Agent 02
RN8uoBwRr1k,Binging with Babish: Paunch Burger from Parks & Rec
xTpr7piQu2M,FUT 21 | Official Trailer
tbsu-AWH-C0,Stephen Sharer - SLUSHIE (Official Music Video)
lcnWx5tiwhM,Exposing My Browsing History!
KnE6u4hFx14,PAINTING OUR FACES ON BRENT'S NEW HOUSE! (REVENGE)
5JC2trEXxhE,Seattle Police Chief Carmen Best will resign Tuesday
BpXkl4VdFhA,Swapping Outfits With A Drag Queen!
3qxGj18nAR4,MY FIRST DAY OF SCHOOL VLOG  *Senior Year* 2020-21
koHs2-xKdEk,2HYPE Goes Shark Fishing!
JXzk8G9aXI8,Avatar Intro but with Animals
YFn3NtG4bJ8,Collin Morikawa | Best Shots from His Final Round 64 at the 2020 PGA Championship
QjB3I4zaKRk,Mozart La Para - El Papá del Lápiz (Video Oficial)
bJbAZh3fv0g,Coming Sept. 4 | Mulan | Disney+
vysBEblWBoQ,Lewis sets UFC record! Derrick Lewis v Alexei Oleinik | UFC Highlights
hEU_MnFTJ_c,LIVE BIRTH OF OUR BABY BOY *EMOTIONAL*
Gj_SlGSZFgA,Who Makes The BEST Hot Dog *Glizzy* 🌭
khhxZRo527Q,Our Fertility Journey: Episode 10
GsL8veaFW-s,North Carolina 5.1 magnitude earthquake felt in several surrounding states
oXTcmpnjdBk,Collin Morikawa Hits Incredible Drive to Win 2020 PGA Championship
6rhLJ6T6NDI,WE SECRETLY FILMED THE DOLAN TWINS | Jeff's Barbershop
Yvlmj0rtnpc,WE DID IT
DrlnrRQK84A,I SURPRISED HIM WITH HIS DREAM CAR!!
xX9PYIIgoEA,Rich Brian & eaJ of DAY6 - LOVE IN MY POCKET ❤️
F82kzN-ae3o,Grilled Ribeye Steak Sausage
Q_KW4u0t07k,QUESADILLAS | Mexican Survival Guide
iR7UweUPeNw,"Can LeBron, AD and Kyle Kuzma Become LA's New ‘Big Three’? | NBA on TNT Tuesday"
ysdw7cmigZM,"Game Theory: Minecraft, Stop Using Diamonds!"
3LqQB4HV8qg,I rescued my cat from the sewer
UcXVnupm0zk,DID YOU FEEL IT? 5.1 magnitude earthquake in North Carolina
LNDhIGR-83w,Beirut explosion: Video shows new angle of the massive blast
0a5YhsnITFE,"LFR13 - QR, Game 5 - Done - CBJ 3, Tor 0"
avgBgc210bg,New videos of Beirut massive explosion emerging online
CiCT7NCP6BY,Rod Wave - Letter From Houston (Official Music Video)
nk44yPCN3gM,$3000 vs. $500 Suspension Upgrade
MKHriv5r8pk,Meet Kohl (Date #3) | Brooklyn's 10 DATES in 10 DAYS
qn515i8xr-4,Surprising Thomas with a Motorcycle!!
Oe9naV81gdY,12 Types of People on TikTok
nX0NDmm1K1g,I hate the I am not a robot verification.
53sqVjcdM4Q,Rating My Wife's Pregnancy Outfits
6Taz7ZzPYeI,DaBaby - Blind feat Young Thug (Official Audio)
fHKNO3DV78M,"Trump halts payroll tax, extends jobless benefits"
#NAME?,Lapiz Conciente - 9 Dias
YwJyis4yOEA,ANSWERING YOUR ASSUMPTIONS ABOUT US 😭
4OCcbUZuTUQ,TREASURE – ‘BOY’ 0809 SBS Inkigayo
kzST_Q2Xbks,Draymond Green Shares Why He's Picking LeBron as the MVP | NBA on TNT
arijxoU5nB0,"TIPPING DELIVERY DRIVERS $1,000 DOLLARS!!"
z9i14AlzWL0,VIDEOS that are truly funny
lw68FF0GEX8,JEOPARDY: SIDEMEN EDITION
gSc0o6xVnmY,Juice WRLD & The Weeknd - Smile (Official Lyric Video)
8r1D-vNUWsg,☁️ 🍞 CLOUD BREAD
YIlhmtpDjmo,WHAT KSI SHOULD HAVE BOUGHT TOBI FOR SIDEMEN SUNDAY
6f-jjV5LJoE,Road Rage – Why Motorcycle Riders Smash Windows
LI1hCQ-6P0Y,AN UMBRELLA ACADEMY UNBOXING
QsUfsZzxi9c,"Whatever You Build, I'll Pay For!"
EukpxRuDUzA,Prepping My Apartment for My Boyfriend to Move In!
THQH9QJKrIE,"Trump signs executive orders on unemployment, evictions, student loans and payroll tax"
xCkpA4_H1x4,UPDATE: CLAN WARS 2 ⚔️ How does it work? TV Royale - Clash Royale News
JxAlZOn4QhM,Rod Wave - Rags 2 Riches Ft. Lil Baby & ATR SonSon (Official Audio)
TUlFDVUTsKg,Highlights | Man City 2-1 Real Madrid | Champions League 2020 - Octavos de final | TUDN
Idp1xvmLPHo,LaBrant Family Baby Boy Name Reveal.
A5RHu1lTv14,Satina Wants a Bedtime Story (SATINA SHORT #1)
bpmGuPhGE0Y,Machine Gun Kelly ft. blackbear - my ex's best friend (Official Lyric Video)
tqvEEqWGCyE,The (Real) Delusion That You're a Corpse
qq7MSjXHRTU,Barcelona vs. Napoli | Champions League Round of 16 Highlights | UCL on CBS Sports
XlOLx3fyf10,TESTING TIKTOK ART TUTORIALS
4UiaCC01Vwk,"DISNEY MEDLEY: Frozen II, The Little Mermaid, Moana, Aladdin + MORE"
PORP0q8nThs,Getting Suspended In High School
FU92piysGBg,STILTED TRAMPOLINE STAIRCASE INTO THE OCEAN  | JOOGSQUAD PPJT
C8FzVistDHY,Professor who's been right about every election since 1984 reveals his 2020 prediction
#NAME?,LOGAN PAUL ADDRESSES JAKE PAUL'S FBI RAID
6i01tOMgBDU,Ashnikko - Daisy (Official Video)
HkTTPu_p2ps,Sleepy Hallow - “Water” feat. Sheff G (Official Music Video - WSHH Exclusive)
IxFMyYuPPyw,Fixing Things I've Ruined #2
Of_C9g9O9KY,BABY BOY IS HERE! *OFFICIAL LABOR AND DELIVERY*
RsmttAEp9f4,Bayern Munich vs. Chelsea | Champions League Round of 16 Highlights | UCL on CBS Sports
8tze9Z33K5A,The Proposal Part 2 She Said Yes!
Wc9_dsv5YYA,Doja Cat - Freak (Audio)
qzdGo7FBndA,Apex Legends Season 6 – Boosted Launch Trailer
dktW5r4ldyo,Kane Brown - Cool Again (Official Video) ft. Nelly
aAgJernobg8,GAME OVER - Mozart La Para (Video Oficial)
rmn4F-K2RRI,Boatbuilding - Lining-out for Planking (EP78)
hT3pPAdnlfA,"LAKERS at PACERS | FULL GAME HIGHLIGHTS | August 8, 2020"
JSAfPh1A25E,TREASURE - 'BOY' M/V
f7rq3DeFZew,Lil Keed - Obama Coupe [Official Video]
Djy3WNLz_mM,The coronavirus is mutating. Now what?
kz7gHA2N6nQ,"World's Strongest Man vs $10,000 Safe! *unbreakable*"
mBiWhzeZ_bU,First Shreds! Testing Our Duramax Swapped Camaro at Irwindale Speedway // Knuckle Busters 2 Ep.15
5N8YRren5Z4,Popcaan  - TWIST & TURN (feat. Drake & PARTYNEXTDOOR) (Official Audio)
CfHieQ0SwpA,National SAT Practice Test Day
Svvesc9dW2E,TWICE Reacts To Guess That TWICE Song In Reverse Challenge (K-Pop)
D-ocerKPufk,The Kid LAROI - SELFISH (Official Video)
qQ8domUSU7M,Fall Guys in a Nutshell
Dz3kroYIUkU,Jake Paul's Calabasas home raided by FBI
vrYcnMWWOeI,Odd1sOut VS Alex Clark: Planning Chess Boxing  ( Part 2 )
v97FPN2US2o,Joji & Diplo - Daylight (Official Music Video)
N2YxXgco_68,MORE toys that evaporate the ADHD from my body
JFm7YDVlqnI,Drake - Laugh Now Cry Later (Official Music Video) ft. Lil Durk
FbM1yi4mMMc,I Bought A Private Island
0C80BSgjb8M,YoungBoy Never Broke Again - Kacey talk
YNyFAro1E5M,Polo G - Martin & Gina (Official Video)
euiSHuaw6Q4,Nineteen Eighty-Fortnite - #FreeFortnite
IcqFcBmkSoQ,2020 XXL Freshmen Read Mean Comments
EIzazUv2gtI,The Devil All The Time starring Tom Holland & Robert Pattinson | Official Trailer | Netflix
L2O-ZLKLhiw,Film Theory: Rick is a Morty CONFIRMED! (Rick and Morty)
nyzhtvtJWDQ,SuperM 슈퍼엠 ‘100' MV
aS1no1myeTM,Miley Cyrus - Midnight Sky (Official Video)
7XvVaeVdPnQ,The SIDEMEN play FALL GUYS (Sidemen Gaming)
279RNoP5UyU,John Legend - Wild (feat. Gary Clark Jr.) (Official Video)
uf-36RC6JHE,Lapiz  Conciente - El Descanso Eterno
nPO2XNDFWN0,Trey Songz - Circles [Official Music Video]
Db_mZ_2gtLg,Morgan Wallen - 7 Summers (Lyric Video)
pWoerADzny4,Savannah Dexter - Gottem Talking ft. Adam Calhoun (Official Music Video)
ZOcI_9pAR_A,"Food Theory: The TRUE Cost of Winning $1,000,000 at McDonald's (Monopoly)"
_J9Z74dQXrQ,Leipzig vs. Atlético Madrid | Champions League Quarterfinal Highlights | UCL on CBS Sports
dANJlolAYyA,Machine Gun Kelly - concert for aliens (Official Music Video)
CNMvPse-P-g,Madden 21 | The Yard Trailer
1YlsqNMzaL8,sewing a dress from scratch *project runway i'm ready*
dX480fsk510,How Hard Fighting Game Combos used to be
